{
  "$schema": "http://json-schema.org/draft-07/schema#",
  "$id": "https://openweight.org/schemas/workout-template.schema.json",
  "title": "WorkoutTemplate",
  "description": "A planned workout with target sets and reps",
  "type": "object",
  "required": ["name", "exercises"],
  "additionalProperties": true,
  "properties": {
    "name": {
      "title": "Name",
      "description": "Name of the workout template",
      "type": "string",
      "minLength": 1,
      "maxLength": 200,
      "examples": ["Push Day", "Upper Body A", "Leg Day"]
    },
    "notes": {
      "title": "Notes",
      "description": "Notes about the workout template",
      "type": "string",
      "maxLength": 10000
    },
    "day": {
      "title": "Day",
      "description": "Day of the week (1=Monday, 7=Sunday). Optional scheduling hint.",
      "type": "integer",
      "minimum": 1,
      "maximum": 7
    },
    "exercises": {
      "title": "Exercises",
      "description": "The exercises in this workout template",
      "type": "array",
      "minItems": 1,
      "items": {
        "$ref": "#/definitions/ExerciseTemplate"
      }
    }
  },
  "definitions": {
    "ExerciseTemplate": {
      "title": "ExerciseTemplate",
      "description": "A planned exercise with target sets",
      "type": "object",
      "required": ["exercise", "sets"],
      "additionalProperties": true,
      "properties": {
        "exercise": {
          "$ref": "#/definitions/Exercise"
        },
        "order": {
          "title": "Order",
          "description": "Position in workout (1-indexed). If omitted, array order is used.",
          "type": "integer",
          "minimum": 1
        },
        "notes": {
          "title": "Notes",
          "description": "Notes specific to this exercise",
          "type": "string",
          "maxLength": 5000
        },
        "supersetId": {
          "title": "Superset ID",
          "description": "Groups exercises into supersets. Same ID = same superset.",
          "type": "integer",
          "minimum": 1
        },
        "sets": {
          "title": "Sets",
          "description": "The target sets for this exercise",
          "type": "array",
          "minItems": 1,
          "items": {
            "$ref": "#/definitions/SetTemplate"
          }
        }
      }
    },
    "Exercise": {
      "title": "Exercise",
      "description": "Describes which exercise to perform",
      "type": "object",
      "required": ["name"],
      "additionalProperties": true,
      "properties": {
        "name": {
          "title": "Name",
          "description": "Human-readable exercise name",
          "type": "string",
          "minLength": 1,
          "maxLength": 200,
          "examples": ["Barbell Back Squat", "Bench Press", "Pull-up"]
        },
        "equipment": {
          "title": "Equipment",
          "description": "Equipment used",
          "type": "string",
          "maxLength": 50,
          "examples": ["barbell", "dumbbell", "bodyweight"]
        },
        "category": {
          "title": "Category",
          "description": "Body part or category",
          "type": "string",
          "maxLength": 50,
          "examples": ["chest", "back", "legs"]
        },
        "musclesWorked": {
          "title": "Muscles Worked",
          "description": "Specific muscles targeted by this exercise",
          "type": "array",
          "items": {
            "type": "string",
            "maxLength": 50
          }
        }
      }
    },
    "SetTemplate": {
      "title": "SetTemplate",
      "description": "A target set with prescribed reps, weight, and intensity",
      "type": "object",
      "additionalProperties": true,
      "allOf": [
        {
          "if": { "required": ["targetWeight"] },
          "then": { "required": ["unit"] }
        },
        {
          "if": { "required": ["percentage"] },
          "then": { "required": ["percentageOf"] }
        }
      ],
      "properties": {
        "targetReps": {
          "title": "Target Reps",
          "description": "Exact number of reps to perform",
          "type": "integer",
          "minimum": 0,
          "examples": [5, 8, 12]
        },
        "targetRepsMin": {
          "title": "Target Reps (Min)",
          "description": "Minimum reps in a rep range",
          "type": "integer",
          "minimum": 0,
          "examples": [8, 10]
        },
        "targetRepsMax": {
          "title": "Target Reps (Max)",
          "description": "Maximum reps in a rep range",
          "type": "integer",
          "minimum": 0,
          "examples": [12, 15]
        },
        "targetWeight": {
          "title": "Target Weight",
          "description": "Absolute weight to use",
          "type": "number",
          "minimum": 0,
          "examples": [100, 60.5, 225]
        },
        "unit": {
          "title": "Unit",
          "description": "Weight unit. Required if targetWeight is provided.",
          "type": "string",
          "enum": ["kg", "lb"]
        },
        "percentage": {
          "title": "Percentage",
          "description": "Percentage of a reference weight (e.g., 80% of 1RM)",
          "type": "number",
          "minimum": 0,
          "maximum": 200,
          "examples": [80, 70, 90]
        },
        "percentageOf": {
          "title": "Percentage Of",
          "description": "Reference for percentage (e.g., '1RM', '5RM')",
          "type": "string",
          "maxLength": 50,
          "examples": ["1RM", "5RM", "10RM"]
        },
        "targetRPE": {
          "title": "Target RPE",
          "description": "Target Rate of Perceived Exertion (0-10)",
          "type": "number",
          "minimum": 0,
          "maximum": 10,
          "examples": [7, 8, 9]
        },
        "targetRIR": {
          "title": "Target RIR",
          "description": "Target Reps In Reserve",
          "type": "integer",
          "minimum": 0,
          "examples": [2, 3, 1]
        },
        "restSeconds": {
          "title": "Rest (seconds)",
          "description": "Recommended rest after this set",
          "type": "integer",
          "minimum": 0,
          "examples": [90, 180, 60]
        },
        "tempo": {
          "title": "Tempo",
          "description": "Tempo notation: eccentric-pause-concentric-pause",
          "type": "string",
          "pattern": "^[0-9X]-[0-9X]-[0-9X]-[0-9X]$",
          "examples": ["3-1-2-0", "4-0-1-0", "2-0-X-0"]
        },
        "type": {
          "title": "Type",
          "description": "Set type (working, warmup, dropset, etc.)",
          "type": "string",
          "maxLength": 50,
          "examples": ["working", "warmup", "dropset"]
        },
        "notes": {
          "title": "Notes",
          "description": "Notes for this set",
          "type": "string",
          "maxLength": 1000
        }
      }
    }
  }
}
